Location,Name,Frequency,Duplex,Offset,Tone,rToneFreq,cToneFreq,DtcsCode,DtcsPolarity,RxDtcsCode,CrossMode,Mode,TStep,Skip,Power,Comment,URCALL,RPT1CALL,RPT2CALL,DVCODE
165,KD8IEK,147.150000,+,0.600000,TSQL,88.5,123.0,023,NN,023,Tone->Tone,FM,5.00,,50W,"KD8IEK near Ithaca, Gratiot County, Michigan OPEN",,,,
166,Water Tower,146.880000,-,0.600000,TSQL,88.5,100.0,023,NN,023,Tone->Tone,FM,5.00,,50W,"W8JXN near Jackson, Jackson County, Michigan OPEN",,,,
167,KA8ZXX,51.620000,-,0.500000,TSQL,88.5,100.0,023,NN,023,Tone->Tone,FM,5.00,,50W,"KA8ZXX near Pleasant Lake, Jackson County, Michigan OPEN",,,,
168,KA8HDY,147.360000,+,0.600000,TSQL,88.5,100.0,023,NN,023,Tone->Tone,FM,5.00,,50W,"KA8HDY near Jackson, Jackson County, Michigan OPEN Linkable to 145.1500 (N8DUY) at Ann Arbor, MI for SKYWARN operations.",,,,
169,Downtown,442.500000,+,5.000000,,88.5,88.5,023,NN,023,Tone->Tone,DMR,5.00,,50W,"N8URW near Jackson, Jackson County, Michigan OPEN",,,,
170,WD8EEQ,443.175000,+,5.000000,TSQL,88.5,77.0,023,NN,023,Tone->Tone,FM,5.00,,50W,"WD8EEQ near Jackson, Jackson County, Michigan OPEN",,,,
171,KA8YRL,444.175000,+,5.000000,TSQL,88.5,100.0,023,NN,023,Tone->Tone,FM,5.00,,50W,"KA8YRL near Jackson, Jackson County, Michigan OPEN Linked to 145.1500 (N8DUY) at Ann Arbor, MI for SKYWARN operations.",,,,
172,Clark Lake,443.750000,,0.000000,Cross,88.5,88.5,754,NN,023,DTCS->,DN,5.00,,50W,"N8URX near Brooklyn, Jackson County, Michigan OPEN COMET GP9 @ 35 FEET power at >25-Watts @ experimental at this time (68794) ROOM ID",,,,
173,KC8LMI,443.875000,+,5.000000,TSQL,88.5,136.5,023,NN,023,Tone->Tone,DN,5.00,,50W,"KC8LMI near Aurelius, Ingham County, Michigan OPEN Linkable to 145.1500 (N8DUY) in Ann Arbor for SkyWarn operations.",,,,
174,KD8IFI,443.000000,+,5.000000,,88.5,88.5,023,NN,023,Tone->Tone,DV,5.00,,50W,"KD8IFI near Lansing, Ingham County, Michigan OPEN",,,,
175,KD8IFI,442.525000,+,5.000000,TSQL,88.5,107.2,023,NN,023,Tone->Tone,FM,5.00,,50W,"KD8IFI near Lansing, Ingham County, Michigan OPEN",,,,
176,Ingham Reg Med Ctr,146.940000,-,0.600000,Tone,100.0,88.5,023,NN,023,Tone->Tone,FM,5.00,,50W,"W8BCI near Lansing, Ingham County, Michigan OPEN If you do not have PL, dial 3, 2, 5 on your keypad to turn the PL off.",,,,
177,Ingham Reg Med Ctr,224.980000,-,1.600000,Tone,100.0,88.5,023,NN,023,Tone->Tone,FM,5.00,,50W,"W8BCI near Lansing, Ingham County, Michigan OPEN",,,,
178,Ingham Reg Med Ctr,146.700000,-,0.600000,Tone,107.2,88.5,023,NN,023,Tone->Tone,FM,5.00,,50W,"W8BCI near Lansing, Ingham County, Michigan OPEN",,,,
179,KB8LCY,147.280000,+,0.600000,TSQL,88.5,100.0,023,NN,023,Tone->Tone,FM,5.00,,50W,"KB8LCY near Lansing, Ingham County, Michigan OPEN",,,,
180,MGL Hospital,442.087500,+,5.000000,,88.5,88.5,023,NN,023,Tone->Tone,DMR,12.50,,50W,"KB8SXK near Lansing, Ingham County, Michigan OPEN",,,,
181,MGL Hospital,444.787500,+,5.000000,,88.5,88.5,023,NN,023,Tone->Tone,DMR,12.50,,50W,"KB8SXK near Lansing, Ingham County, Michigan OPEN",,,,
182,W8IRA,145.470000,-,0.600000,TSQL,88.5,114.8,023,NN,023,Tone->Tone,FM,5.00,,50W,"W8IRA near Onondaga, Ingham County, Michigan OPEN",,,,
183,KD8IEI,145.440000,-,0.600000,,88.5,88.5,023,NN,023,Tone->Tone,DV,5.00,,50W,"KD8IEI near Saint Johns, Clinton County, Michigan OPEN",,,,
184,KD8IEI,442.937500,+,5.000000,,88.5,88.5,023,NN,023,Tone->Tone,DV,12.50,,50W,"KD8IEI near Saint Johns, Clinton County, Michigan OPEN",,,,
185,K8NET,146.740000,-,0.330000,Tone,114.8,88.5,023,NN,023,Tone->Tone,DN,5.00,,50W,"K8NET near Port Hope, Huron County, Michigan OPEN Primarily Connected to WA8BRO - Fusion Equipment Room #01946 -CQ Michigan BrandMeister TG# 3198726, Connected to XLX624 and XLX625 Reflectors, YSF Room #73601",,,,
186,N9UV,442.050000,+,5.000000,Tone,100.0,88.5,023,NN,023,Tone->Tone,FM,5.00,,50W,"N9UV near Dimondale, Eaton County, Michigan OPEN",,,,
187,KC8QVX,444.825000,+,5.000000,TSQL,88.5,107.2,023,NN,023,Tone->Tone,FM,5.00,,50W,"KC8QVX near Jerome, Hillsdale County, Michigan OPEN",,,,
188,N8JI,442.025000,+,5.000000,TSQL,88.5,173.8,023,NN,023,Tone->Tone,FM,5.00,,50W,"N8JI near Potterville, Eaton County, Michigan OPEN",,,,
189,W8QPO,442.650000,+,5.000000,Tone,100.0,88.5,023,NN,023,Tone->Tone,FM,5.00,,50W,"W8QPO near Breckenridge, Gratiot County, Michigan OPEN",,,,
190,Soccer Fields,147.000000,+,0.600000,Tone,103.5,88.5,023,NN,023,Tone->Tone,FM,5.00,,50W,"W8KEA near Midland, Midland County, Michigan OPEN Moving to the old Midland Family Life Radio Station on M-20 west of Midland.",,,,
191,KC8ARJ,444.350000,+,5.000000,,88.5,88.5,023,NN,023,Tone->Tone,DV,5.00,,50W,"KC8ARJ near Midland, Midland County, Michigan OPEN",,,,
192,KD8IEK,443.137500,+,5.000000,,88.5,88.5,023,NN,023,Tone->Tone,DV,12.50,,50W,"KD8IEK near Ithaca, Gratiot County, Michigan OPEN",,,,
193,K8CHR,147.080000,+,0.600000,TSQL,88.5,103.5,023,NN,023,Tone->Tone,FM,5.00,,50W,"K8CHR near Charlotte, Eaton County, Michigan OPEN",,,,
194,N8HEE,442.262500,+,5.000000,,88.5,88.5,023,NN,023,Tone->Tone,DMR,12.50,,50W,"N8HEE near Charlotte, Eaton County, Michigan OPEN",,,,
195,County EOC,443.437500,+,5.000000,,88.5,88.5,023,NN,023,Tone->Tone,DV,12.50,,50W,"K8ETN near Charlotte, Eaton County, Michigan OPEN",,,,
196,N8HEE,443.625000,+,5.000000,TSQL,88.5,100.0,023,NN,023,Tone->Tone,FM,5.00,,50W,"N8HEE near Charlotte, Eaton County, Michigan OPEN",,,,
197,County EOC,145.200000,-,0.600000,,88.5,88.5,023,NN,023,Tone->Tone,DV,5.00,,50W,"K8ETN near Charlotte, Eaton County, Michigan OPEN",,,,
198,Alma College,145.370000,-,0.600000,Tone,100.0,88.5,023,NN,023,Tone->Tone,FM,5.00,,50W,"KC8MUV near Alma, Gratiot County, Michigan OPEN",,,,
199,N8ZMT,145.130000,-,0.600000,TSQL,88.5,94.8,023,NN,023,Tone->Tone,FM,5.00,,50W,"N8ZMT near Portland, Ionia County, Michigan OPEN",,,,
200,Pleasant Valley,146.720000,-,0.600000,TSQL,88.5,103.5,023,NN,023,Tone->Tone,DN,5.00,,50W,"KA8IBY near Midland, Midland County, Michigan OPEN  Notes Digitally linked full-time to Eastern-MI-Link Room which covers all of Eastern Michigan with linked digital repeaters from Toledo, OH to Grayling Michigan including Detroit.",,,,
201,KA8IBY,146.720000,-,0.600000,TSQL,88.5,103.5,023,NN,023,Tone->Tone,DN,5.00,,50W,"KA8IBY near Oil City, Midland County, Michigan OPEN",,,,
202,W8COP,147.060000,+,0.600000,TSQL,88.5,103.5,023,NN,023,Tone->Tone,DN,5.00,,50W,"W8COP near Sterling, Arenac County, Michigan OPEN",,,,
203,W8IRA,145.150000,-,0.600000,Tone,103.5,88.5,023,NN,023,Tone->Tone,FM,5.00,,50W,"W8IRA near Mount Pleasant, Isabella County, Michigan OPEN",,,,
204,KC8RTU,442.825000,+,5.000000,Tone,100.0,88.5,023,NN,023,Tone->Tone,FM,5.00,,50W,"KC8RTU near Mount Pleasant, Isabella County, Michigan OPEN",,,,
205,KD8RHB,147.120000,+,0.600000,Tone,186.2,88.5,023,NN,023,Tone->Tone,FM,5.00,,50W,"KD8RHB near Battle Creek, Calhoun County, Michigan OPEN",,,,
206,W8DF,442.762500,+,5.000000,,88.5,88.5,023,NN,023,Tone->Tone,DV,12.50,,50W,"W8DF near Battle Creek, Calhoun County, Michigan OPEN",,,,
207,W8DF,146.790000,-,0.600000,,88.5,88.5,023,NN,023,Tone->Tone,DV,5.00,,50W,"W8DF near Battle Creek, Calhoun County, Michigan OPEN",,,,
208,W8DF,146.660000,-,0.600000,TSQL,88.5,94.8,023,NN,023,Tone->Tone,FM,5.00,,50W,"W8DF near Battle Creek, Calhoun County, Michigan OPEN",,,,
209,Saranac Bus Garage,444.725000,+,5.000000,TSQL,88.5,94.8,023,NN,023,Tone->Tone,DN,5.00,,50W,"WA8RRA near Saranac, Ionia County, Michigan OPEN",,,,
210,W8IRA,145.150000,-,0.600000,Tone,94.8,88.5,023,NN,023,Tone->Tone,FM,5.00,,50W,"W8IRA near Battle Creek, Calhoun County, Michigan OPEN",,,,
211,W8DF,224.240000,-,1.600000,Tone,94.8,88.5,023,NN,023,Tone->Tone,FM,5.00,,50W,"W8DF near Battle Creek, Calhoun County, Michigan OPEN",,,,
212,W8DF,443.950000,+,5.000000,TSQL,88.5,94.8,023,NN,023,Tone->Tone,FM,5.00,,50W,"W8DF near Battle Creek, Calhoun County, Michigan OPEN",,,,
213,WD8KAF,147.300000,+,0.600000,TSQL,88.5,100.0,023,NN,023,Tone->Tone,FM,5.00,,50W,"WD8KAF near Coldwater, Branch County, Michigan OPEN",,,,
214,WD8KAF,442.962500,+,5.000000,,88.5,88.5,023,NN,023,Tone->Tone,DV,12.50,,50W,"WD8KAF near Coldwater, Branch County, Michigan OPEN",,,,
215,WD8KAF,443.300000,+,5.000000,TSQL,88.5,123.0,023,NN,023,Tone->Tone,FM,5.00,,50W,"WD8KAF near Coldwater, Branch County, Michigan OPEN",,,,
216,Barry Co EOC,442.725000,+,5.000000,,88.5,88.5,023,NN,023,Tone->Tone,DN,5.00,,50W,"K8BMI near Hastings, Barry County, Michigan OPEN",,,,
217,WB8VWK,146.800000,-,0.600000,TSQL,88.5,103.5,023,NN,023,Tone->Tone,FM,5.00,,50W,"WB8VWK near Edmore, Montcalm County, Michigan OPEN",,,,
218,KC8LEQ,444.700000,+,5.000000,Tone,103.5,88.5,023,NN,023,Tone->Tone,FM,5.00,,50W,"KC8LEQ near Edmore, Montcalm County, Michigan OPEN",,,,
219,K8EO,442.450000,+,5.000000,TSQL,88.5,173.8,023,NN,023,Tone->Tone,DN,5.00,,50W,"K8EO near Gladwin, Gladwin County, Michigan OPEN",,,,
220,W8GDW,147.180000,+,0.600000,TSQL,88.5,173.8,023,NN,023,Tone->Tone,DN,5.00,,50W,"W8GDW near Gladwin, Gladwin County, Michigan OPEN",,,,
221,K8YPW,146.840000,-,0.600000,Tone,94.8,88.5,023,NN,023,Tone->Tone,FM,5.00,,50W,"K8YPW near Hastings, Barry County, Michigan OPEN",,,,
222,KD8RXD,443.387500,+,5.000000,,88.5,88.5,023,NN,023,Tone->Tone,DMR,12.50,,50W,"KD8RXD near Greenville, Montcalm County, Michigan OPEN c-Bridge partner with DMR-MARC",,,,
223,W8LRC,145.270000,-,0.600000,Tone,94.8,88.5,023,NN,023,Tone->Tone,FM,5.00,,50W,"W8LRC near Lowell, Kent County, Michigan OPEN",,,,
224,KD8RXD,443.112500,+,5.000000,,88.5,88.5,023,NN,023,Tone->Tone,DMR,12.50,,50W,"KD8RXD near Lowell, Kent County, Michigan OPEN c-Bridge partner with DMR-MARC",,,,
225,Lake Lancer,145.250000,-,0.600000,TSQL,88.5,103.5,023,NN,023,Tone->Tone,DN,5.00,,50W,"W8CSX near Gladwin, Gladwin County, Michigan OPEN",,,,
226,W8USA,444.450000,+,5.000000,TSQL,88.5,94.8,023,NN,023,Tone->Tone,DN,5.00,,50W,"W8USA near Grand Rapids, Kent County, Michigan OPEN",,,,
227,KD8TUV,147.200000,+,0.600000,TSQL,88.5,103.5,023,NN,023,Tone->Tone,DN,5.00,,50W,"KD8TUV near Harrison, Clare County, Michigan OPEN Linked Full-Time to Detroit-Metro Room- a group of Fusion linked repeaters covering Eastern Michigan including Detroit.",,,,
228,Pointer Hill Park,146.940000,-,0.600000,TSQL,88.5,103.5,023,NN,023,Tone->Tone,DN,5.00,,50W,"K8OAR near West Branch, Ogemaw County, Michigan OPEN",,,,
229,WBMI Tower,444.225000,+,5.000000,TSQL,88.5,107.2,023,NN,023,Tone->Tone,FM,5.00,,50W,"KD8NCN near West Branch, Ogemaw County, Michigan OPEN",,,,
230,Water Tower,147.050000,+,0.600000,TSQL,88.5,107.2,023,NN,023,Tone->Tone,FM,5.00,,50W,"K8DYS near Harrison, Clare County, Michigan OPEN",,,,
231,N8RSH,147.080000,+,0.600000,,88.5,88.5,023,NN,023,Tone->Tone,DN,5.00,,50W,"N8RSH near Lupton, Ogemaw County, Michigan OPEN",,,,
232,NW8J,224.140000,-,1.600000,,88.5,88.5,023,NN,023,Tone->Tone,FM,5.00,,50W,"NW8J near Cedar Springs, Kent County, Michigan OPEN",,,,
233,NW8J,146.880000,-,0.600000,Tone,141.3,88.5,023,NN,023,Tone->Tone,DN,5.00,,50W,"NW8J near Cedar Springs, Kent County, Michigan OPEN",,,,
234,NW8J,443.075000,+,5.000000,Tone,94.8,88.5,023,NN,023,Tone->Tone,DN,5.00,,50W,"NW8J near Cedar Springs, Kent County, Michigan OPEN Repeater Node# 11924 / West Michigan Room# 21924",,,,
235,Kalamazoo Co EOC,443.400000,+,5.000000,,88.5,88.5,023,NN,023,Tone->Tone,DMR,5.00,,50W,"KM8CC near Kalamazoo, Kalamazoo County, Michigan OPEN See our Groups.io page for TG information",,,,
236,Borgess Hospital,444.500000,+,5.000000,,88.5,88.5,023,NN,023,Tone->Tone,DV,5.00,,50W,"NK8X near Kalamazoo, Kalamazoo County, Michigan OPEN",,,,
237,W8SZ,147.040000,+,0.600000,TSQL,88.5,123.0,023,NN,023,Tone->Tone,FM,5.00,,50W,"W8SZ near Harrisville, Alcona County, Michigan OPEN",,,,
238,WM8TG,442.550000,+,5.000000,,88.5,88.5,023,NN,023,Tone->Tone,DV,5.00,,50W,"WM8TG near Grand Rapids, Kent County, Michigan OPEN",,,,
239,W8DMI,145.110000,-,0.600000,TSQL,88.5,131.8,023,NN,023,Tone->Tone,DN,5.00,,50W,"W8DMI near Rose City, Ogemaw County, Michigan OPEN",,,,
240,K8WM,444.775000,+,5.000000,Tone,94.8,88.5,023,NN,023,Tone->Tone,FM,5.00,,50W,"K8WM near Grand Rapids, Kent County, Michigan OPEN",,,,
241,K8KZO,147.040000,+,0.600000,TSQL,88.5,94.8,023,NN,023,Tone->Tone,FM,5.00,,50W,"K8KZO near Kalamazoo, Kalamazoo County, Michigan OPEN",,,,
242,W8VY,444.650000,+,5.000000,TSQL,88.5,94.8,023,NN,023,Tone->Tone,FM,5.00,,50W,"W8VY near Kalamazoo, Kalamazoo County, Michigan OPEN",,,,
243,K8KZO,444.875000,+,5.000000,TSQL,88.5,94.8,023,NN,023,Tone->Tone,DN,5.00,,50W,"K8KZO near Kalamazoo, Kalamazoo County, Michigan OPEN Use CTCSS tone to avoid hearing digital traffic.",,,,
244,KD8MEY,224.920000,-,1.600000,TSQL,88.5,94.8,023,NN,023,Tone->Tone,FM,5.00,,50W,"KD8MEY near Grand Rapids, Kent County, Michigan OPEN",,,,
245,K8SN,442.075000,+,5.000000,TSQL,88.5,103.5,023,NN,023,Tone->Tone,FM,5.00,,50W,"K8SN near Morley, Mecosta County, Michigan OPEN",,,,
246,K8SN,443.225000,+,5.000000,,88.5,88.5,023,NN,023,Tone->Tone,DN,5.00,,50W,"K8SN near Moline, Allegan County, Michigan OPEN",,,,
247,WM8TG,147.290000,+,0.600000,,88.5,88.5,023,NN,023,Tone->Tone,DV,5.00,,50W,"WM8TG near Grand Rapids, Kent County, Michigan OPEN",,,,
248,K8SN,442.387500,+,5.000000,,88.5,88.5,023,NN,023,Tone->Tone,DMR,12.50,,50W,"K8SN near Moline, Allegan County, Michigan OPEN",,,,
249,Green Lake,223.920000,-,1.600000,TSQL,88.5,94.8,023,NN,023,Tone->Tone,FM,5.00,,50W,"N8JPR near Moline, Allegan County, Michigan OPEN Part of the West Michigan Technical Group",,,,
250,K8SN,442.175000,+,5.000000,TSQL,88.5,103.5,023,NN,023,Tone->Tone,FM,5.00,,50W,"K8SN near Moline, Allegan County, Michigan OPEN",,,,
251,Lost Lake Woods,442.012500,+,5.000000,,88.5,88.5,023,NN,023,Tone->Tone,DMR,12.50,,50W,"W8JJR near Lincoln, Alcona County, Michigan OPEN c-Bridge partner of DMR-MARC",,,,
252,NW8J,145.110000,-,0.600000,TSQL,88.5,94.8,023,NN,023,Tone->Tone,FM,5.00,,50W,"NW8J near Grand Rapids, Kent County, Michigan CLOSED Closed repeater for emergency use only!",,,,
253,W8DC,146.760000,-,0.600000,TSQL,88.5,94.8,023,NN,023,Tone->Tone,DN,5.00,,50W,"W8DC near Grand Rapids, Kent County, Michigan OPEN",,,,
254,W8IRA,147.160000,+,0.600000,TSQL,88.5,94.8,023,NN,023,Tone->Tone,FM,5.00,,50W,"W8IRA near Grand Rapids, Kent County, Michigan OPEN",,,,
255,W8DC,147.260000,+,0.600000,TSQL,88.5,94.8,023,NN,023,Tone->Tone,FM,5.00,,50W,"W8DC near Grand Rapids, Kent County, Michigan OPEN",,,,
256,KR8T,443.800000,+,5.000000,TSQL,88.5,94.8,023,NN,023,Tone->Tone,FM,5.00,,50W,"KR8T near Grand Rapids, Kent County, Michigan OPEN",,,,
257,N8NET,444.100000,+,5.000000,Tone,94.8,88.5,023,NN,023,Tone->Tone,DN,5.00,,50W,"N8NET near Grand Rapids, Kent County, Michigan OPEN",,,,
258,Downtown,444.250000,+,5.000000,,88.5,88.5,023,NN,023,Tone->Tone,DMR,5.00,,50W,"N8JSN near Grand Rapids, Kent County, Michigan OPEN",,,,
259,N8WKN,444.325000,+,5.000000,Tone,82.5,88.5,023,NN,023,Tone->Tone,FM,5.00,,50W,"N8WKN near Grand Rapids, Kent County, Michigan OPEN",,,,
260,W8DC,444.400000,+,5.000000,Tone,94.8,88.5,023,NN,023,Tone->Tone,FM,5.00,,50W,"W8DC near Grand Rapids, Kent County, Michigan OPEN",,,,
261,KD8RXD,444.625000,+,5.000000,,88.5,88.5,023,NN,023,Tone->Tone,DMR,5.00,,50W,"KD8RXD near Byron Center, Kent County, Michigan OPEN c-Bridge partner with DMR-MARC",,,,
262,W8VY,147.000000,+,0.600000,Tone,94.8,88.5,023,NN,023,Tone->Tone,FM,5.00,,50W,"W8VY near Kalamazoo, Kalamazoo County, Michigan OPEN For Downtown Kalamazoo and Richland use PL tone 127.3 Hz.",,,,
263,Leota,444.900000,+,5.000000,TSQL,88.5,107.2,023,NN,023,Tone->Tone,FM,5.00,,50W,"KC8QVX near Harrison, Clare County, Michigan OPEN",,,,
264,KE8OHG,146.840000,-,0.600000,Tone,103.5,88.5,023,NN,023,Tone->Tone,FM,5.00,,50W,"KE8OHG near Prudenville, Roscommon County, Michigan OPEN",,,,
265,Glen Oaks CC,145.310000,-,0.600000,TSQL,88.5,123.0,023,NN,023,Tone->Tone,DN,5.00,,50W,"K8SJC near Centreville, Saint Joseph County, Michigan OPEN",,,,
266,Red Cross Bldg,224.300000,-,1.600000,,88.5,88.5,023,NN,023,Tone->Tone,FM,5.00,,50W,"W8VY near Oshtemo, Kalamazoo County, Michigan OPEN",,,,
267,WB8ZIR,145.490000,-,0.600000,Tone,100.0,88.5,023,NN,023,Tone->Tone,FM,5.00,,50W,"WB8ZIR near Barton City, Alcona County, Michigan OPEN",,,,
268,Glen Oaks CC,442.150000,+,5.000000,TSQL,88.5,94.8,023,NN,023,Tone->Tone,FM,5.00,,50W,"KC8BRO near Centreville, Saint Joseph County, Michigan OPEN",,,,
269,K8WM,145.410000,-,0.600000,TSQL,88.5,94.8,023,NN,023,Tone->Tone,FM,5.00,,50W,"K8WM near Grand Rapids, Kent County, Michigan OPEN",,,,
270,KE8GLB,145.390000,-,0.600000,Tone,103.5,88.5,023,NN,023,Tone->Tone,FM,5.00,,50W,"KE8GLB near Houghton Lake, Roscommon County, Michigan OPEN",,,,
271,W8USA,145.230000,-,0.600000,TSQL,88.5,94.8,023,NN,023,Tone->Tone,DN,5.00,,50W,"W8USA near Sparta, Kent County, Michigan OPEN",,,,
272,K8TB,147.100000,+,0.600000,TSQL,88.5,94.8,023,NN,023,Tone->Tone,FM,5.00,,50W,"K8TB near Jenison, Ottawa County, Michigan OPEN",,,,
273,Ferris State University,443.900000,+,5.000000,,88.5,88.5,023,NN,023,Tone->Tone,FM,5.00,,50W,"KB8QOI near Big Rapids, Mecosta County, Michigan OPEN",,,,
274,W8IRA,145.290000,-,0.600000,Tone,94.8,88.5,023,NN,023,Tone->Tone,FM,5.00,,50W,"W8IRA near Big Rapids, Mecosta County, Michigan OPEN",,,,
275,KD8RXD,442.212500,+,5.000000,,88.5,88.5,023,NN,023,Tone->Tone,DMR,12.50,,50W,"KD8RXD near Kent City, Kent County, Michigan OPEN c-Bridge partner with DMR-MARC",,,,
276,N9KOP,145.350000,-,0.600000,,88.5,88.5,023,NN,023,Tone->Tone,FM,5.00,,50W,"N9KOP near Mio, Oscoda County, Michigan OPEN",,,,
277,K8DDX,444.975000,+,5.000000,Tone,103.5,88.5,023,NN,023,Tone->Tone,DN,5.00,,50W,"K8DDX near Mio, Oscoda County, Michigan OPEN",,,,
278,AC8RC,147.240000,+,0.600000,TSQL,88.5,94.8,023,NN,023,Tone->Tone,FM,5.00,,50W,"AC8RC near Allegan, Allegan County, Michigan OPEN",,,,
279,K8TB,442.250000,+,5.000000,TSQL,88.5,94.8,023,NN,023,Tone->Tone,DN,5.00,,50W,"K8TB near Hudsonville, Ottawa County, Michigan OPEN",,,,
280,K8IHY,444.900000,+,5.000000,Tone,94.8,88.5,023,NN,023,Tone->Tone,FM,5.00,,50W,"K8IHY near Hudsonville, Ottawa County, Michigan OPEN",,,,
281,N8QOP,145.450000,-,0.600000,TSQL,88.5,141.3,023,NN,023,Tone->Tone,FM,5.00,,50W,"N8QOP near Roscommon, Roscommon County, Michigan OPEN",,,,
282,N8QOP,443.100000,+,5.000000,TSQL,88.5,146.2,023,NN,023,Tone->Tone,FM,5.00,,50W,"N8QOP near Roscommon, Roscommon County, Michigan OPEN",,,,
283,AC8DX,147.200000,+,0.600000,Tone,94.8,88.5,023,NN,023,Tone->Tone,FM,5.00,,50W,"AC8DX near Gobles, Van Buren County, Michigan OPEN",,,,
284,WDEE Tower,146.740000,-,0.600000,,88.5,88.5,023,NN,023,Tone->Tone,FM,5.00,,50W,"KB8QOI near Big Rapids, Mecosta County, Michigan OPEN",,,,
285,N8GH,444.475000,+,5.000000,TSQL,88.5,94.8,023,NN,023,Tone->Tone,FM,5.00,,50W,"N8GH near Lawton, Van Buren County, Michigan OPEN",,,,
286,N9KOP,146.700000,-,0.600000,TSQL,88.5,103.5,023,NN,023,Tone->Tone,FM,5.00,,50W,"N9KOP near Mio, Oscoda County, Michigan OPEN",,,,
287,W8CMN,444.700000,+,5.000000,,88.5,88.5,023,NN,023,Tone->Tone,DMR,5.00,,50W,"W8CMN near Mio, Oscoda County, Michigan OPEN",,,,
288,MSP,145.340000,-,0.600000,,88.5,88.5,023,NN,023,Tone->Tone,DV,5.00,,50W,"W8VY near Paw Paw, Van Buren County, Michigan OPEN",,,,
289,W8FSM,443.925000,+,5.000000,,88.5,88.5,023,NN,023,Tone->Tone,DMR,5.00,,50W,"W8FSM near Hamilton, Allegan County, Michigan OPEN c-Bridge partner with DMR-MARC",,,,
290,N8FYZ,145.170000,-,0.600000,TSQL,88.5,94.8,023,NN,023,Tone->Tone,FM,5.00,,50W,"N8FYZ near Paw Paw, Van Buren County, Michigan OPEN",,,,
291,Maike Fire LO,145.450000,-,0.600000,TSQL,88.5,94.8,023,NN,023,Tone->Tone,DN,5.00,,50W,"KB8IFE near White Cloud, Newaygo County, Michigan OPEN",,,,
292,Maike Fire LO,444.975000,+,5.000000,TSQL,88.5,94.8,023,NN,023,Tone->Tone,DN,5.00,,50W,"KB8IFE near White Cloud, Newaygo County, Michigan OPEN",,,,
293,KD8CAO,445.500000,-,5.000000,Tone,94.8,88.5,023,NN,023,Tone->Tone,FM,5.00,,50W,"KD8CAO near Zeeland, Ottawa County, Michigan OPEN",,,,
294,MSP,444.075000,+,5.000000,,88.5,88.5,023,NN,023,Tone->Tone,DV,5.00,,50W,"W8VY near Paw Paw, Van Buren County, Michigan OPEN",,,,
295,KC8MSE,146.920000,-,0.600000,Tone,94.8,88.5,023,NN,023,Tone->Tone,FM,5.00,,50W,"KC8MSE near Fremont, Newaygo County, Michigan OPEN",,,,
296,K8DAA,146.500000,+,1.000000,TSQL,88.5,94.8,023,NN,023,Tone->Tone,FM,5.00,,50W,"K8DAA near Holland, Ottawa County, Michigan OPEN",,,,
297,K8DAA,147.060000,+,0.600000,Tone,94.8,88.5,023,NN,023,Tone->Tone,FM,5.00,,50W,"K8DAA near Holland, Ottawa County, Michigan OPEN",,,,
298,K8DAA,443.825000,+,5.000000,TSQL,88.5,94.8,023,NN,023,Tone->Tone,FM,5.00,,50W,"K8DAA near Holland, Ottawa County, Michigan OPEN",,,,
299,Hospital,443.887500,+,5.000000,,88.5,88.5,023,NN,023,Tone->Tone,DMR,12.50,,50W,"K8DAA near Holland, Ottawa County, Michigan OPEN",,,,
300,N8XPQ,444.800000,+,5.000000,TSQL,88.5,103.5,023,NN,023,Tone->Tone,DN,5.00,,50W,"N8XPQ near Holland, Ottawa County, Michigan OPEN Connected full-time to WM-CONNECT WiRES-X Room# 21335",,,,
301,N8AHZ,145.130000,-,0.600000,TSQL,88.5,107.2,023,NN,023,Tone->Tone,DN,5.00,,50W,"N8AHZ near Grayling, Crawford County, Michigan OPEN",,,,
302,K8BRC,147.360000,+,0.600000,TSQL,88.5,94.8,023,NN,023,Tone->Tone,FM,5.00,,50W,"K8BRC near Bangor, Van Buren County, Michigan OPEN Anyone is welcome to join our nets. Club meetings are the second Saturday of each month. See website for more information.",,,,
303,K8OEC,443.575000,+,5.000000,,88.5,88.5,023,NN,023,Tone->Tone,DMR,5.00,,50W,"K8OEC near West Olive, Ottawa County, Michigan OPEN c-Bridge partner with DMR-MARC",,,,
304,K8BRC,444.300000,+,5.000000,TSQL,88.5,94.8,023,NN,023,Tone->Tone,DN,5.00,,50W,"K8BRC near Bangor, Van Buren County, Michigan OPEN",,,,
305,W8CT,444.825000,+,5.000000,,88.5,88.5,023,NN,023,Tone->Tone,DN,5.00,,50W,"W8CT near Cadillac, Wexford County, Michigan OPEN",,,,
306,K8CAD,146.980000,-,0.600000,,88.5,88.5,023,NN,023,Tone->Tone,FM,5.00,,50W,"K8CAD near Cadillac, Wexford County, Michigan OPEN One mile north of TV-9 tower.",,,,
307,W8IRA,147.160000,+,0.600000,Tone,103.5,88.5,023,NN,023,Tone->Tone,FM,5.00,,50W,"W8IRA near Cadillac, Wexford County, Michigan OPEN",,,,
308,W8MAB,147.210000,+,0.600000,,88.5,88.5,023,NN,023,Tone->Tone,FM,5.00,,50W,"W8MAB near Bitely, Newaygo County, Michigan OPEN",,,,
309,AC8GN,146.960000,-,0.600000,TSQL,88.5,94.8,023,NN,023,Tone->Tone,FM,5.00,,50W,"AC8GN near Saugatuck, Allegan County, Michigan OPEN",,,,
310,AC8GN,442.700000,+,5.000000,Cross,88.5,94.8,023,NN,023,->Tone,FM,5.00,,50W,"AC8GN near Saugatuck, Allegan County, Michigan OPEN",,,,
311,N8VPZ,146.920000,-,0.600000,TSQL,88.5,156.7,023,NN,023,Tone->Tone,FM,5.00,,50W,"N8VPZ near Cassopolis, Cass County, Michigan OPEN Backup repeater to KU8Y 145.210 for Cass county RACES/Skywarn",,,,
312,WD8MKG,147.320000,+,0.600000,TSQL,88.5,91.5,023,NN,023,Tone->Tone,FM,5.00,,50W,"WD8MKG near Holton, Muskegon County, Michigan OPEN Non-club affiliated repeater opened to all licensed amateur radio operators.",,,,
313,Manning Hill,146.760000,-,0.600000,Tone,88.5,88.5,023,NN,023,Tone->Tone,FM,5.00,,50W,"K8PA near Alpena, Alpena County, Michigan OPEN",,,,
314,W6GVS,146.500000,+,1.000000,TSQL,88.5,94.8,023,NN,023,Tone->Tone,FM,5.00,,50W,"W6GVS near Dowagiac, Cass County, Michigan OPEN",,,,
315,W8CSO,145.490000,-,0.600000,TSQL,88.5,94.8,023,NN,023,Tone->Tone,DN,5.00,,50W,"W8CSO near Grand Haven, Ottawa County, Michigan OPEN Local Net - Tuesday, 8pm West Michigan K8SN Emergency Communications Net - Wednesday, 8pm",,,,
316,W8CSO,443.775000,+,5.000000,Tone,94.8,88.5,023,NN,023,Tone->Tone,DN,5.00,,50W,"W8CSO near Grand Haven, Ottawa County, Michigan OPEN",,,,
317,Wolf Lake,146.900000,-,0.600000,TSQL,88.5,94.8,023,NN,023,Tone->Tone,DN,5.00,,50W,"AF8U near Baldwin, Lake County, Michigan OPEN",,,,
318,N8UKF,443.200000,+,5.000000,,88.5,88.5,023,NN,023,Tone->Tone,DN,5.00,,50W,"N8UKF near Norton Shores, Muskegon County, Michigan OPEN",,,,
319,W8MAI,146.820000,-,0.600000,TSQL,88.5,88.5,023,NN,023,Tone->Tone,FM,5.00,,50W,"W8MAI near Sister Lakes, Van Buren County, Michigan OPEN",,,,
320,W8IRA,145.330000,-,0.600000,Tone,94.8,88.5,023,NN,023,Tone->Tone,FM,5.00,,50W,"W8IRA near Muskegon, Muskegon County, Michigan OPEN",,,,
321,K8WNJ,146.820000,-,0.600000,Tone,94.8,88.5,023,NN,023,Tone->Tone,FM,5.00,,50W,"K8WNJ near Muskegon, Muskegon County, Michigan OPEN",,,,
322,W8ZHO,146.940000,-,0.600000,Tone,94.8,88.5,023,NN,023,Tone->Tone,FM,5.00,,50W,"W8ZHO near Muskegon, Muskegon County, Michigan OPEN Hometown Radio Club - Muskegon Area Amateur Radio Council",,,,
323,N8KQQ,224.700000,-,1.600000,Tone,94.8,88.5,023,NN,023,Tone->Tone,FM,5.00,,50W,"N8KQQ near Muskegon, Muskegon County, Michigan OPEN",,,,
324,N8UKF,442.300000,+,5.000000,,88.5,88.5,023,NN,023,Tone->Tone,DN,5.00,,50W,"N8UKF near Muskegon, Muskegon County, Michigan OPEN Repeater is linked to FCS Reflector 4 - Room 034",,,,
325,N8KQQ,442.950000,+,5.000000,Tone,94.8,88.5,023,NN,023,Tone->Tone,FM,5.00,,50W,"N8KQQ near Muskegon, Muskegon County, Michigan OPEN",,,,
326,W8ZHO,444.550000,+,5.000000,Tone,94.8,88.5,023,NN,023,Tone->Tone,FM,5.00,,50W,"W8ZHO near Muskegon, Muskegon County, Michigan OPEN",,,,
327,K8WNJ,444.950000,+,5.000000,Tone,94.8,88.5,023,NN,023,Tone->Tone,FM,5.00,,50W,"K8WNJ near Muskegon, Muskegon County, Michigan OPEN",,,,
328,Downtown,145.360000,-,0.600000,,88.5,88.5,023,NN,023,Tone->Tone,DV,5.00,,50W,"K8WNJ near Muskegon, Muskegon County, Michigan OPEN",,,,
329,Downtown,444.012500,+,5.000000,,88.5,88.5,023,NN,023,Tone->Tone,DV,12.50,,50W,"K8WNJ near Muskegon, Muskegon County, Michigan OPEN",,,,
330,KE8LZ,147.380000,+,0.600000,,88.5,88.5,023,NN,023,Tone->Tone,DN,5.00,,50W,"KE8LZ near Muskegon, Muskegon County, Michigan OPEN",,,,
331,W8MAI,444.700000,+,5.000000,TSQL,88.5,97.4,023,NN,023,Tone->Tone,FM,5.00,,50W,"W8MAI near Sister Lakes, Van Buren County, Michigan OPEN",,,,
332,NW8J,145.430000,-,0.600000,Tone,94.8,88.5,023,NN,023,Tone->Tone,FM,5.00,,50W,"NW8J near Walkerville, Oceana County, Michigan OPEN",,,,
